describe,evaluate,introduce,movie_name,serial_number,star
一部能引人思考的科幻励志片。,195616人评价,"导演: 安德鲁·尼科尔 Andrew Niccol 主演: 伊桑·霍克 Ethan Hawke / 乌玛...,1997 / 美国 / 剧情 科幻 惊悚",千钧一发,240,8.8
新闻人的理性求真。,221732人评价,"导演: 托马斯·麦卡锡 Thomas McCarthy 主演: 马克·鲁弗洛 Mark Ruffalo /...,2015 / 美国 / 剧情 传记",聚焦,241,8.8
宝莱坞的萝莉与大叔。,384984人评价,"导演: 卡比尔·汗 Kabir Khan 主演: 萨尔曼·汗 Salman Khan / 哈莎莉·马...,2015 / 印度 / 剧情 喜剧 动作",小萝莉的猴神大叔,242,8.4
诺兰的牛逼来源于内心散发出的恐惧。,143158人评价,"导演: 克里斯托弗·诺兰 Christopher Nolan 主演: 杰里米·西奥伯德 Jeremy...,1998 / 英国 / 犯罪 悬疑 惊悚",追随,243,8.9
一个精彩的世界观正在缓缓建立。,284378人评价,"导演: Andy Wachowski / Larry Wachowski 主演: 基努·里维斯 Keanu Reeves...,2003 / 美国 澳大利亚 / 动作 科幻",黑客帝国2：重装上阵,244,8.6
你要相信，这世上真的有爱存在，不管在什么年纪 ,120816人评价,"导演: 秋昌民 Chang-min Choo 主演: 宋在河 Jae-ho Song / 李顺载 Soon-jae...,2011 / 韩国 / 剧情 爱情",我爱你,245,9.0
还原真实而残酷的战争。,227508人评价,"导演: 雷德利·斯科特 Ridley Scott 主演: 乔什·哈奈特 Josh Hartnett / ...,2001 / 美国 英国 / 动作 历史 战争",黑鹰坠落,246,8.7
只有有信仰的人才能说出事实真相。,207740人评价,"导演: 阿斯哈·法哈蒂 Asghar Farhadi 主演: 佩曼·莫阿迪 Peyman Moadi /...,2011 / 伊朗 法国 / 剧情 家庭",一次别离,247,8.7
,305582人评价,"导演: 刘伟强 / 麦兆辉 主演: 陈冠希 / 余文乐 / 曾志伟,2003 / 中国香港 / 动作 犯罪 剧情 惊悚",无间道2,248,8.6
,406963人评价,"导演: 阿尼什·查甘蒂 Aneesh Chaganty 主演: 约翰·赵 John Cho / 米切尔...,2018 / 美国 俄罗斯 / 剧情 犯罪 悬疑 惊悚",网络谜踪,249,8.6
,124082人评价,"导演: 今敏 Satoshi Kon 主演: 江守彻 Toru Emori / 梅垣义明 Yoshiaki Ume...,2003 / 日本 / 剧情 喜剧 动画",东京教父,250,9.0
